,Name,Year of Release,Genre,IMDB Rating,Metascore,Director(s),Star(s),Summary,Votes,Gross Earning
1,The Shawshank Redemption,1994,Drama,9.3,82,Frank Darabont,"Tim Robbins, Morgan Freeman, Bob Gunton, William Sadler","Over the course of several years, two convicts form a friendship, seeking consolation and, eventually, redemption through basic compassion.","2,814,520",$28.34M
2,The Godfather,1972,"Crime, Drama",9.2,100,Francis Ford Coppola,"Marlon Brando, Al Pacino, James Caan, Diane Keaton","Don Vito Corleone, head of a mafia family, decides to hand over his empire to his youngest son Michael. However, his decision unintentionally puts the lives of his loved ones in grave danger.","1,961,544",$134.97M
3,The Dark Knight,2008,"Action, Crime, Drama",9.0,84,Christopher Nolan,"Christian Bale, Heath Ledger, Aaron Eckhart, Michael Caine","When the menace known as the Joker wreaks havoc and chaos on the people of Gotham, Batman must accept one of the greatest psychological and physical tests of his ability to fight injustice.","2,796,190",$534.86M
4,Schindler's List,1993,"Biography, Drama, History",9.0,95,Steven Spielberg,"Liam Neeson, Ralph Fiennes, Ben Kingsley, Caroline Goodall","In German-occupied Poland during World War II, industrialist Oskar Schindler gradually becomes concerned for his Jewish workforce after witnessing their persecution by the Nazis.","1,414,846",$96.90M
5,The Lord of the Rings: The Return of the King,2003,"Action, Adventure, Drama",9.0,94,Peter Jackson,"Elijah Wood, Viggo Mortensen, Ian McKellen, Orlando Bloom",Gandalf and Aragorn lead the World of Men against Sauron's army to draw his gaze from Frodo and Sam as they approach Mount Doom with the One Ring.,"1,927,232",$377.85M
6,12 Angry Men,1957,"Crime, Drama",9.0,97,Sidney Lumet,"Henry Fonda, Lee J. Cobb, Martin Balsam, John Fiedler",The jury in a New York City murder trial is frustrated by a single member whose skeptical caution forces them to more carefully consider the evidence before jumping to a hasty verdict.,"838,414",$4.36M
7,The Godfather Part II,1974,"Crime, Drama",9.0,90,Francis Ford Coppola,"Al Pacino, Robert De Niro, Robert Duvall, Diane Keaton","The early life and career of Vito Corleone in 1920s New York City is portrayed, while his son, Michael, expands and tightens his grip on the family crime syndicate.","1,331,789",$57.30M
8,Pulp Fiction,1994,"Crime, Drama",8.9,95,Quentin Tarantino,"John Travolta, Uma Thurman, Samuel L. Jackson, Bruce Willis","The lives of two mob hitmen, a boxer, a gangster and his wife, and a pair of diner bandits intertwine in four tales of violence and redemption.","2,158,475",$107.93M
9,Fight Club,1999,Drama,8.8,67,David Fincher,"Brad Pitt, Edward Norton, Meat Loaf, Zach Grenier",An insomniac office worker and a devil-may-care soap maker form an underground fight club that evolves into much more.,"2,249,369",$37.03M
10,Inception,2010,"Action, Adventure, Sci-Fi",8.8,74,Christopher Nolan,"Leonardo DiCaprio, Joseph Gordon","A thief who steals corporate secrets through the use of dream-sharing technology is given the inverse task of planting an idea into the mind of a C.E.O., but his tragic past may doom the project and his team to disaster.","2,481,777",$292.58M
11,The Lord of the Rings: The Fellowship of the Ring,2001,"Action, Adventure, Drama",8.8,92,Peter Jackson,"Elijah Wood, Ian McKellen, Orlando Bloom, Sean Bean",A meek Hobbit from the Shire and eight companions set out on a journey to destroy the powerful One Ring and save Middle-earth from the Dark Lord Sauron.,"1,954,679",$315.54M
12,Forrest Gump,1994,"Drama, Romance",8.8,82,Robert Zemeckis,"Tom Hanks, Robin Wright, Gary Sinise, Sally Field","The history of the United States from the 1950s to the '70s unfolds from the perspective of an Alabama man with an IQ of 75, who yearns to be reunited with his childhood sweetheart.","2,191,680",$330.25M
13,"The Good, the Bad and the Ugly",1966,"Adventure, Western",8.8,90,Sergio Leone,"Clint Eastwood, Eli Wallach, Lee Van Cleef, Aldo Giuffr",A bounty hunting scam joins two men in an uneasy alliance against a third in a race to find a fortune in gold buried in a remote cemetery.,"793,199",$6.10M
14,The Lord of the Rings: The Two Towers,2002,"Action, Adventure, Drama",8.8,87,Peter Jackson,"Elijah Wood, Ian McKellen, Viggo Mortensen, Orlando Bloom","While Frodo and Sam edge closer to Mordor with the help of the shifty Gollum, the divided fellowship makes a stand against Sauron's new ally, Saruman, and his hordes of Isengard.","1,738,200",$342.55M
15,Jai Bhim,2021,"Crime, Drama, Mystery",8.8,,T.J. Gnanavel,"Suriya, Lijo Mol Jose, Manikandan K., Rajisha Vijayan","When a tribal man is arrested for a case of alleged theft, his wife turns to a human-rights lawyer to help bring justice.","211,749",
16,Spider-Man: Across the Spider-Verse,2023,"Animation, Action, Adventure",8.7,86,"Joaquim Dos Santos, Kemp Powers, Justin K. Thompson","Shameik Moore, Hailee Steinfeld, Brian Tyree Henry, Luna Lauren Velez","Miles Morales catapults across the Multiverse, where he encounters a team of Spider-People charged with protecting its very existence. When the heroes clash on how to handle a new threat, Miles must redefine what it means to be a hero.","285,101",
17,Interstellar,2014,"Adventure, Drama, Sci-Fi",8.7,74,Christopher Nolan,"Matthew McConaughey, Anne Hathaway, Jessica Chastain, Mackenzie Foy","When Earth becomes uninhabitable in the future, a farmer and ex-NASA pilot, Joseph Cooper, is tasked to pilot a spacecraft, along with a team of researchers, to find a new planet for humans.","2,006,278",$188.02M
18,Goodfellas,1990,"Biography, Crime, Drama",8.7,92,Martin Scorsese,"Robert De Niro, Ray Liotta, Joe Pesci, Lorraine Bracco","The story of Henry Hill and his life in the mafia, covering his relationship with his wife Karen and his mob partners Jimmy Conway and Tommy DeVito.","1,222,450",$46.84M
19,The Matrix,1999,"Action, Sci-Fi",8.7,73,"Lana Wachowski, Lilly Wachowski","Keanu Reeves, Laurence Fishburne, Carrie","When a beautiful stranger leads computer hacker Neo to a forbidding underworld, he discovers the shocking truth--the life he knows is the elaborate deception of an evil cyber-intelligence.","2,001,028",$171.48M
20,One Flew Over the Cuckoo's Nest,1975,Drama,8.7,84,Milos Forman,"Jack Nicholson, Louise Fletcher, Michael Berryman, Peter Brocco","In the Fall of 1963, a Korean War veteran and criminal pleads insanity and is admitted to a mental institution, where he rallies up the scared patients against the tyrannical nurse.","1,048,404",$112.00M
21,Star Wars: Episode V - The Empire Strikes Back,1980,"Action, Adventure, Fantasy",8.7,82,Irvin Kershner,"Mark Hamill, Harrison Ford, Carrie Fisher, Billy Dee Williams","After the Rebels are overpowered by the Empire, Luke Skywalker begins his Jedi training with Yoda, while his friends are pursued across the galaxy by Darth Vader and bounty hunter Boba Fett.","1,348,691",$290.48M
22,The Silence of the Lambs,1991,"Crime, Drama, Thriller",8.6,86,Jonathan Demme,"Jodie Foster, Anthony Hopkins, Scott Glenn, Ted Levine","A young F.B.I. cadet must receive the help of an incarcerated and manipulative cannibal killer to help catch another serial killer, a madman who skins his victims.","1,504,348",$130.74M
23,Se7en,1995,"Crime, Drama, Mystery",8.6,65,David Fincher,"Morgan Freeman, Brad Pitt, Kevin Spacey, Andrew Kevin Walker","Two detectives, a rookie and a veteran, hunt a serial killer who uses the seven deadly sins as his motives.","1,744,963",$100.13M
24,Saving Private Ryan,1998,"Drama, War",8.6,91,Steven Spielberg,"Tom Hanks, Matt Damon, Tom Sizemore, Edward Burns","Following the Normandy Landings, a group of U.S. soldiers go behind enemy lines to retrieve a paratrooper whose brothers have been killed in action.","1,457,992",$216.54M
25,Star Wars: Episode IV - A New Hope,1977,"Action, Adventure, Fantasy",8.6,90,George Lucas,"Mark Hamill, Harrison Ford, Carrie Fisher, Alec Guinness","Luke Skywalker joins forces with a Jedi Knight, a cocky pilot, a Wookiee and two droids to save the galaxy from the Empire's world-destroying battle station, while also attempting to rescue Princess Leia from the mysterious Darth Vader.","1,419,963",$322.74M
26,The Green Mile,1999,"Crime, Drama, Fantasy",8.6,61,Frank Darabont,"Tom Hanks, Michael Clarke Duncan, David Morse, Bonnie Hunt","A tale set on death row in a Southern jail, where gentle giant John possesses the mysterious power to heal people's ailments. When the lead guard, Paul, recognizes John's gift, he tries to help stave off the condemned man's execution.","1,368,868",$136.80M
27,Spirited Away,2001,"Animation, Adventure, Family",8.6,96,Hayao Miyazaki,"Daveigh Chase, Suzanne Pleshette, Miyu Irino, Rumi Hiiragi","During her family's move to the suburbs, a sullen 10-year-old girl wanders into a world ruled by gods, witches and spirits, a world where humans are changed into beasts.","816,066",$10.06M
28,City of God,2002,"Crime, Drama",8.6,79,"Fernando Meirelles, K","Alexandre Rodrigues, Leandro Firmino, Matheus Nachtergaele, Phellipe Haagensen","In the slums of Rio, two kids' paths diverge as one struggles to become a photographer and the other a kingpin.","785,018",$7.56M
29,Terminator 2: Judgment Day,1991,"Action, Sci-Fi",8.6,75,James Cameron,"Arnold Schwarzenegger, Linda Hamilton, Edward Furlong, Robert Patrick","A cyborg, identical to the one who failed to kill Sarah Connor, must now protect her ten year old son John from an even more advanced and powerful cyborg.","1,147,386",$204.84M
30,Life Is Beautiful,1997,"Comedy, Drama, Romance",8.6,59,Roberto Benigni,"Roberto Benigni, Nicoletta Braschi, Giorgio Cantarini, Giustino Durano","When an open-minded Jewish waiter and his son become victims of the Holocaust, he uses a perfect mixture of will, humor and imagination to protect his son from the dangers around their camp.","726,248",$57.60M
31,It's a Wonderful Life,1946,"Drama, Family, Fantasy",8.6,89,Frank Capra,"James Stewart, Donna Reed, Lionel Barrymore, Thomas Mitchell",An angel is sent from Heaven to help a desperately frustrated businessman by showing him what life would have been like if he had never existed.,"481,325",
32,Seven Samurai,1954,"Action, Drama",8.6,98,Akira Kurosawa,Toshir,"Farmers from a village exploited by bandits hire a veteran samurai for protection, who gathers six other samurai to join him.","359,627",$0.27M
33,Harakiri,1962,"Action, Drama, Mystery",8.6,85,Masaki Kobayashi,"Tatsuya Nakadai, Akira Ishihama, Shima Iwashita, Tetsur","When a ronin requesting seppuku at a feudal lord's palace is told of the brutal suicide of another ronin who previously visited, he reveals how their pasts are intertwined - and in doing so challenges the clan's integrity.","64,672",
34,Oppenheimer,2023,"Biography, Drama, History",8.5,88,Christopher Nolan,"Cillian Murphy, Emily Blunt, Matt Damon, Robert Downey Jr.","The story of American scientist, J. Robert Oppenheimer, and his role in the development of the atomic bomb.","471,645",
35,The Departed,2006,"Crime, Drama, Thriller",8.5,85,Martin Scorsese,"Leonardo DiCaprio, Matt Damon, Jack Nicholson, Mark Wahlberg",An undercover cop and a mole in the police attempt to identify each other while infiltrating an Irish gang in South Boston.,"1,387,759",$132.38M
36,Back to the Future,1985,"Adventure, Comedy, Sci-Fi",8.5,87,Robert Zemeckis,"Michael J. Fox, Christopher Lloyd, Lea Thompson, Crispin Glover","Marty McFly, a 17-year-old high school student, is accidentally sent 30 years into the past in a time-traveling DeLorean invented by his close friend, the maverick scientist Doc Brown.","1,271,024",$210.61M
37,Gladiator,2000,"Action, Adventure, Drama",8.5,67,Ridley Scott,"Russell Crowe, Joaquin Phoenix, Connie Nielsen, Oliver Reed",A former Roman General sets out to exact vengeance against the corrupt emperor who murdered his family and sent him into slavery.,"1,572,289",$187.71M
38,Alien,1979,"Horror, Sci-Fi",8.5,89,Ridley Scott,"Sigourney Weaver, Tom Skerritt, John Hurt, Veronica Cartwright",The crew of a commercial spacecraft encounters a deadly lifeform after investigating an unknown transmission.,"925,205",$78.90M
39,Parasite,2019,"Drama, Thriller",8.5,96,Bong Joon Ho,Song Kang,Greed and class discrimination threaten the newly formed symbiotic relationship between the wealthy Park family and the destitute Kim clan.,"898,468",$53.37M
40,The Prestige,2006,"Drama, Mystery, Sci-Fi",8.5,66,Christopher Nolan,"Christian Bale, Hugh Jackman, Scarlett Johansson, Michael Caine","After a tragic accident, two stage magicians in 1890s London engage in a battle to create the ultimate illusion while sacrificing everything they have to outwit each other.","1,404,243",$53.09M
41,Django Unchained,2012,"Drama, Western",8.5,81,Quentin Tarantino,"Jamie Foxx, Christoph Waltz, Leonardo DiCaprio, Kerry Washington","With the help of a German bounty-hunter, a freed slave sets out to rescue his wife from a brutal plantation owner in Mississippi.","1,645,163",$162.81M
42,Psycho,1960,"Horror, Mystery, Thriller",8.5,97,Alfred Hitchcock,"Anthony Perkins, Janet Leigh, Vera Miles, John Gavin","A Phoenix secretary embezzles $40,000 from her employer's client, goes on the run and checks into a remote motel run by a young man under the domination of his mother.","703,276",$32.00M
43,Whiplash,2014,"Drama, Music",8.5,89,Damien Chazelle,"Miles Teller, J.K. Simmons, Melissa Benoist, Paul Reiser",A promising young drummer enrolls at a cut-throat music conservatory where his dreams of greatness are mentored by an instructor who will stop at nothing to realize a student's potential.,"940,704",$13.09M
44,Léon: The Professional,1994,"Action, Crime, Drama",8.5,64,Luc Besson,"Jean Reno, Gary Oldman, Natalie Portman, Danny Aiello","12-year-old Mathilda is reluctantly taken in by Léon, a professional assassin, after her family is murdered. An unusual relationship forms as she becomes his protégée and learns the assassin's trade.","1,215,293",$19.50M
45,The Pianist,2002,"Biography, Drama, Music",8.5,85,Roman Polanski,"Adrien Brody, Thomas Kretschmann, Frank Finlay, Emilia Fox",A Polish Jewish musician struggles to survive the destruction of the Warsaw ghetto of World War II.,"884,030",$32.57M
46,The Usual Suspects,1995,"Crime, Drama, Mystery",8.5,77,Bryan Singer,"Kevin Spacey, Gabriel Byrne, Chazz Palminteri, Stephen Baldwin",The sole survivor of a pier shoot-out tells the story of how a notorious criminal influenced the events that began with five criminals meeting in a seemingly random police lineup.,"1,123,654",$23.34M
47,The Lion King,1994,"Animation, Adventure, Drama",8.5,88,"Roger Allers, Rob Minkoff","Matthew Broderick, Jeremy Irons, James Earl Jones, Whoopi Goldberg","Lion prince Simba and his father are targeted by his bitter uncle, who wants to ascend the throne himself.","1,112,138",$422.78M
48,American History X,1998,"Crime, Drama",8.5,62,Tony Kaye,"Edward Norton, Edward Furlong, Beverly D","Living a life marked by violence, neo-Nazi Derek finally goes to prison after killing two black youths. Upon his release, Derek vows to change; he hopes to prevent his brother, Danny, who idolizes Derek, from following in his footsteps.","1,163,526",$6.72M
49,The Intouchables,2011,"Biography, Comedy, Drama",8.5,57,"Olivier Nakache, ",Fran,"After he becomes a quadriplegic from a paragliding accident, an aristocrat hires a young man from the projects to be his caregiver.","903,608",$13.18M
50,Casablanca,1942,"Drama, Romance, War",8.5,100,Michael Curtiz,"Humphrey Bogart, Ingrid Bergman, Paul Henreid, Claude Rains",A cynical expatriate American cafe owner struggles to decide whether or not to help his former lover and her fugitive husband escape the Nazis in French Morocco.,"594,344",$1.02M
51,Once Upon a Time in the West,1968,Western,8.5,82,Sergio Leone,"Henry Fonda, Charles Bronson, Claudia Cardinale, Jason Robards",A mysterious stranger with a harmonica joins forces with a notorious desperado to protect a beautiful widow from a ruthless assassin working for the railroad.,"342,993",$5.32M
52,Grave of the Fireflies,1988,"Animation, Drama, War",8.5,94,Isao Takahata,"Tsutomu Tatsumi, Ayano Shiraishi, Akemi Yamaguchi, Yoshiko Shinohara",A young boy and his little sister struggle to survive in Japan during World War II.,"298,140",
53,Rear Window,1954,"Mystery, Thriller",8.5,100,Alfred Hitchcock,"James Stewart, Grace Kelly, Wendell Corey, Thelma Ritter","A photographer in a wheelchair spies on his neighbors from his Greenwich Village courtyard apartment window, and becomes convinced one of them has committed murder, despite the skepticism of his fashion-model girlfriend.","511,443",$36.76M
54,Cinema Paradiso,1988,"Drama, Romance",8.5,80,Giuseppe Tornatore,"Philippe Noiret, Enzo Cannavale, Antonella Attili, Isa Danieli",A filmmaker recalls his childhood when falling in love with the pictures at the cinema of his home village and forms a deep friendship with the cinema's projectionist.,"275,516",$11.99M
55,Modern Times,1936,"Comedy, Drama, Romance",8.5,96,Charles Chaplin,"Charles Chaplin, Paulette Goddard, Henry Bergman, Tiny Sandford",The Tramp struggles to live in modern industrial society with the help of a young homeless woman.,"253,837",$0.16M
56,City Lights,1931,"Comedy, Drama, Romance",8.5,99,Charles Chaplin,"Charles Chaplin, Virginia Cherrill, Florence Lee, Harry Myers","With the aid of a wealthy erratic tippler, a dewy-eyed tramp who has fallen in love with a sightless flower girl accumulates money to be able to help her medically.","192,222",$0.02M
57,The Shining,1980,"Drama, Horror",8.4,66,Stanley Kubrick,"Jack Nicholson, Shelley Duvall, Danny Lloyd, Scatman Crothers","A family heads to an isolated hotel for the winter where a sinister presence influences the father into violence, while his psychic son sees horrific forebodings from both past and future.","1,078,498",$44.02M
58,Joker,2019,"Crime, Drama, Thriller",8.4,59,Todd Phillips,"Joaquin Phoenix, Robert De Niro, Zazie Beetz, Frances Conroy","During the 1980s, a failed stand-up comedian is driven insane and turns to a life of crime and chaos in Gotham City while becoming an infamous psychopathic crime figure.","1,415,532",$335.45M
59,Avengers: Endgame,2019,"Action, Adventure, Drama",8.4,78,"Anthony Russo, Joe Russo","Robert Downey Jr., Chris Evans, Mark Ruffalo, Chris Hemsworth","After the devastating events of Avengers: Infinity War (2018), the universe is in ruins. With the help of remaining allies, the Avengers assemble once more in order to reverse Thanos' actions and restore balance to the universe.","1,222,834",$858.37M
60,Inglourious Basterds,2009,"Adventure, Drama, War",8.4,69,Quentin Tarantino,"Brad Pitt, Diane Kruger, Eli Roth, M","In Nazi-occupied France during World War II, a plan to assassinate Nazi leaders by a group of Jewish U.S. soldiers coincides with a theatre owner's vengeful plans for the same.","1,534,748",$120.54M
61,Apocalypse Now,1979,"Drama, Mystery, War",8.4,94,Francis Ford Coppola,"Martin Sheen, Marlon Brando, Robert Duvall, Frederic Forrest",A U.S. Army officer serving in Vietnam is tasked with assassinating a renegade Special Forces Colonel who sees himself as a god.,"695,168",$83.47M
62,Spider-Man: Into the Spider-Verse,2018,"Animation, Action, Adventure",8.4,87,"Bob Persichetti, Peter Ramsey, Rodney Rothman","Shameik Moore, Jake Johnson, Hailee Steinfeld, Mahershala Ali",Teen Miles Morales becomes the Spider-Man of his universe and must join with five spider-powered individuals from other dimensions to stop a threat for all realities.,"636,903",$190.24M
63,Coco,2017,"Animation, Adventure, Drama",8.4,81,"Lee Unkrich, Adrian Molina","Anthony Gonzalez, Gael Garc","Aspiring musician Miguel, confronted with his family's ancestral ban on music, enters the Land of the Dead to find his great-great-grandfather, a legendary singer.","561,367",$209.73M
64,Come and See,1985,"Drama, Thriller, War",8.4,,Elem Klimov,"Aleksey Kravchenko, Olga Mironova, Liubomiras Laucevicius, Vladas Bagdonas","After finding an old rifle, a young boy joins the Soviet resistance movement against ruthless German forces and experiences the horrors of World War II.","91,225",
65,Oldboy,2003,"Action, Drama, Mystery",8.4,78,Park Chan,Choi Min,"After being kidnapped and imprisoned for fifteen years, Oh Dae-Su is released, only to find that he must find his captor in five days.","615,260",$0.71M
66,Aliens,1986,"Action, Adventure, Sci-Fi",8.4,84,James Cameron,"Sigourney Weaver, Michael Biehn, Carrie Henn, Paul Reiser","Decades after surviving the Nostromo incident, Ellen Ripley is sent out to re-establish contact with a terraforming colony but finds herself battling the Alien Queen and her offspring.","746,718",$85.16M
67,The Dark Knight Rises,2012,"Action, Drama, Thriller",8.4,78,Christopher Nolan,"Christian Bale, Tom Hardy, Anne Hathaway, Gary Oldman","Eight years after the Joker's reign of chaos, Batman is coerced out of exile with the assistance of the mysterious Selina Kyle in order to defend Gotham City from the vicious guerrilla terrorist Bane.","1,784,648",$448.14M
68,Memento,2000,"Mystery, Thriller",8.4,83,Christopher Nolan,"Guy Pearce, Carrie",A man with short-term memory loss attempts to track down his wife's murderer.,"1,293,366",$25.54M
69,Raiders of the Lost Ark,1981,"Action, Adventure",8.4,86,Steven Spielberg,"Harrison Ford, Karen Allen, Paul Freeman, John Rhys","In 1936, archaeologist and adventurer Indiana Jones is hired by the U.S. government to find the Ark of the Covenant before the Nazis can obtain its awesome powers.","1,017,171",$248.16M
70,Avengers: Infinity War,2018,"Action, Adventure, Sci-Fi",8.4,68,"Anthony Russo, Joe Russo","Robert Downey Jr., Chris Hemsworth, Mark Ruffalo, Chris Evans",The Avengers and their allies must be willing to sacrifice all in an attempt to defeat the powerful Thanos before his blitz of devastation and ruin puts an end to the universe.,"1,163,289",$678.82M
71,Amadeus,1984,"Biography, Drama, Music",8.4,87,Milos Forman,"F. Murray Abraham, Tom Hulce, Elizabeth Berridge, Roy Dotrice","The life, success and troubles of Wolfgang Amadeus Mozart, as told by Antonio Salieri, the contemporaneous composer who was deeply jealous of Mozart's talent and claimed to have murdered him.","419,119",$51.97M
72,Your Name.,2016,"Animation, Drama, Fantasy",8.4,81,Makoto Shinkai,"Ryunosuke Kamiki, Mone Kamishiraishi, Ryo Narita, Aoi Y","Two teenagers share a profound, magical connection upon discovering they are swapping bodies. Things manage to become even more complicated when the boy and girl decide to meet in person.","302,345",$5.02M
73,3 Idiots,2009,"Comedy, Drama",8.4,67,Rajkumar Hirani,"Aamir Khan, Madhavan, Mona Singh, Sharman Joshi","Two friends are searching for their long lost companion. They revisit their college days and recall the memories of their friend who inspired them to think differently, even as the rest of the world called them ""idiots"".","420,576",$6.53M
74,WALL·E,2008,"Animation, Adventure, Family",8.4,95,Andrew Stanton,"Ben Burtt, Elissa Knight, Jeff Garlin, Fred Willard","In the distant future, a small waste-collecting robot inadvertently embarks on a space journey that will ultimately decide the fate of mankind.","1,170,230",$223.81M
75,The Lives of Others,2006,"Drama, Mystery, Thriller",8.4,89,Florian Henckel von Donnersmarck,Ulrich M,"In 1984 East Berlin, an agent of the secret police, conducting surveillance on a writer and his lover, finds himself becoming increasingly absorbed by their lives.","402,939",$11.29M
76,Dr. Strangelove or: How I Learned to Stop Worrying and Love the Bomb,1964,"Comedy, War",8.4,97,Stanley Kubrick,"Peter Sellers, George C. Scott, Sterling Hayden, Keenan Wynn","An insane American general orders a bombing attack on the Soviet Union, triggering a path to nuclear holocaust that a war room full of politicians and generals frantically tries to stop.","508,636",$0.28M
77,Capernaum,2018,Drama,8.4,75,Nadine Labaki,"Zain Al Rafeea, Yordanos Shiferaw, Boluwatife Treasure Bankole, Kawsar Al Haddad","While serving a five-year sentence for a violent crime, a 12-year-old boy sues his parents for neglect.","100,211",$1.66M
78,Das Boot,1981,"Drama, War",8.4,86,Wolfgang Petersen,J,A German U-boat stalks the frigid waters of the North Atlantic as its young crew experience the sheer terror and claustrophobic life of a submariner in World War II.,"259,857",$11.49M
79,Sunset Blvd.,1950,"Drama, Film-Noir",8.4,94,Billy Wilder,"William Holden, Gloria Swanson, Erich von Stroheim, Nancy Olson",A screenwriter develops a dangerous relationship with a faded film star determined to make a triumphant return.,"231,525",
80,The Great Dictator,1940,"Comedy, Drama, War",8.4,,Charles Chaplin,"Charles Chaplin, Paulette Goddard, Jack Oakie, Reginald Gardiner",Dictator Adenoid Hynkel tries to expand his empire while a poor Jewish barber tries to avoid persecution from Hynkel's regime.,"233,066",$0.29M
81,Paths of Glory,1957,"Drama, War",8.4,90,Stanley Kubrick,"Kirk Douglas, Ralph Meeker, Adolphe Menjou, George Macready","After refusing to attack an enemy position, a general accuses the soldiers of cowardice and their commanding officer must defend them.","207,351",
82,Witness for the Prosecution,1957,"Crime, Drama, Mystery",8.4,76,Billy Wilder,"Tyrone Power, Marlene Dietrich, Charles Laughton, Elsa Lanchester",A veteran British barrister must defend his client in a murder trial that has surprise after surprise.,"133,377",$8.18M
83,High and Low,1963,"Crime, Drama, Mystery",8.4,90,Akira Kurosawa,Toshir,An executive of a Yokohama shoe company becomes a victim of extortion when his chauffeur's son is kidnapped by mistake and held for ransom.,"50,368",
